package_name,description,url,year_of_release,adjectives,pros,cons,query,who,benefits,drawbacks, pros/cons,release_year
torrent-tracker-health,Health check performance monitoring for BitTorrent trackers.,https://www.npmjs.com/package/torrent-tracker-health,2016.0,"['Specific', 'Efficient', 'Reliable']",,,health tracker,cohere,,,"{'Pros': 'Specially tailored to handle the unique demands of BitTorrent tracking.', 'Cons': 'Not suitable for other types of health tracking.'}",
webtorrent-health,Health checking and metrics for WebTorrent infra.,https://www.npmjs.com/package/webtorrent-health,2018.0,"['Adaptable', 'Measurable', 'Secure']",,,health tracker,cohere,,,"{'Pros': 'Can function seamlessly within the WebTorrent infra.', 'Cons': 'Lack of broad compatibility and may require specific frameworks.'}",
windows.devices.pointofservice,Enables apps to interact with Point of Service (POS) devices on Windows platforms.,https://www.npmjs.com/package/windows.devices.pointofservice,2018.0,"['Robust', 'Streamlined', 'Versatile']",,,health tracker,cohere,,,"{'Pros': 'Ideal for managing health-related transactions and receipts on Windows devices.', 'Cons': 'Limited compatibility outside of Windows ecosystem.'}",
carotte-dashboard,A versatile dashboard design provides numerous options for visualization.,https://www.npmjs.com/package/carotte-dashboard,2018.0,"['Intuitive', 'Customizable', 'Interoperable']",,,health tracker,cohere,,,"{'Pros': 'The wide range of visualization options makes data insight accessible.', 'Cons': 'Some users have complained of over-complexity and slower performance.'}",
googleclientlogin,Google Client Login is a JavaScript library that simplifies the process of authentication with Google APIs.,https://github.com/google/google-api-javascript-client-library/tree/master/client/oauth2,,"['Popular', 'Trustworthy', 'Simplistic']","Most users already have Google logged in, which simplifies the login process.","Older version, potential security updates and newer features not included.",captcha authentication,cohere,,,,
homosapien,"Homosapien is a suite of tools for use in the creation of rich, interactive, browser-based tutorials, quizzes, and exams.",http://www.homosapien.org/,2008.0,"['Versatile', 'Trustworthy', 'Feature-rich']","All-in-one solution for quizzes and exams, which may streamline development.","Not a sole solution for captcha integration, may require extensive backend adjustments.",captcha authentication,cohere,,,,
jacket-captcha,"A simple, intuitive API for working with CAPTCHA widgets.",https://github.com/jacket/jacket-captcha,2013.0,"['Modern', 'Intuitive', 'Simple']","Recent codebase, more prone to having solutions for common issues and newer features.","Specifically designed for CAPTCHA widgets, fewer features than competing packages.",captcha authentication,cohere,,,,
detect-lang,A node module that can detect the language of a given text.,https://www.npmjs.com/package/detect-lang,2017.0,"['Accurate', 'Easy-to-use', 'Reliable']",Among the most accurate packages for language detection.,"Sometimes, the detection might confuse similar languages.",detect text language,cohere,,,,
retext-language,A node module that identifies languages and extracts text in various languages.,https://www.npmjs.com/package/retext-language,2017.0,"['Powerful', 'Flexible', 'Multilingual']",Can process multiple languages and is very versatile.,It may not work optimally for structured or short text.,detect text language,cohere,,,,
thf-mobile-cli,A full-stack framework for building mobile apps with an automated tools suite and a modern JavaScript stack,https://github.com/Thalheimer/thf-mobile-cli,,"['Full-Stack', 'Automated', 'Modern']","All-in-one, intuitive solution for mobile app development",,mobile app framework,cohere,,,,
catjs,A simple and intuitive JavaScript framework for building mobile apps and web applications with a clean programming model and minimal runtime dependency,https://github.com/catjs/catjs,,"['Intuitive', 'Clean', 'Minimal']",Simple and easy to get started,May lack advanced features for more complex applications,mobile app framework,cohere,,,,2013.0
sabertooth,"A JavaScript framework for building mobile and desktop apps with a focus on speed, efficiency, and scalability. It helps developers to organize code efficiently and streamline development workflows",https://github.com/sabertooth-io/sabertooth,,"['Efficient', 'Scalable', 'Streamlined']",Focuses on efficiency and scalability,Learning curve due to extensive customization,mobile app framework,cohere,,,,2015.0
librestapi,Open-source framework for creating REST APIs and handling server-side functionality for mobile apps. Focuses on performance and modular design,https://github.com/librest/librestapi,,"['Modular', 'Performant', 'Open-Source']",Focuses on performance and modular design,May require more custom configuration for mobile-specific features,mobile app framework,cohere,,,,2016.0
islider.js,A lightweight mobile sliding menu widget built for jQuery and Zepto.js,https://github.com/kontra/islider,,"['Lightweight', 'Mobile-Optimized', 'Widget']",Optimized for mobile and lightweight,May not have extensive features for larger applications,mobile app framework,cohere,,,,2013.0
samson.js,A minimalistic JavaScript framework for mobile application development,https://github.com/samsonjs/samson,,"['Minimalistic', 'Lightweight', 'Versatile']",Simple and easy to get started,May require more additional plugins to accomplish complex tasks,mobile app framework,cohere,,,,2014.0
ionic-logging-service,A robust and comprehensive logging service for Ionic apps,https://github.com/johndavidsimon/ionic-logging-service,,"['Robust', 'Comprehensive', 'Ionic-Friendly']",Dedicated logging service for Ionic apps,,mobile app framework,cohere,,,,2018.0
generator-m-ionic,"A Yeoman generator for Ionic v1 projects. It installs and configures a basic Ionic project, along with Cordova and Node.js.",https://github.com/johndavidsimon/generator-m-ionic,,"[' Yeoman ', 'Ionic-Friendly', 'Simplifying']",Quickly sets up a basic Ionic project for development,,mobile app framework,cohere,,,,2017.0
generator-angular-pro,"A powerful Yeoman generator for Angular projects, offering a range of common options and configurations for quick and streamlined starting points",https://github.com/angular-boot/generator-angular-pro,,"['Powerful', 'Streamlined', 'Angular-Centric']",Quickly sets up a basic Angular project for development with advanced options,May be too advanced for beginners,mobile app framework,cohere,,,,2018.0
generator-adaptiveme,"A flexible, modular, and powerful Yeoman generator for creating adaptive web apps",https://github.com/AdaptiveConsult/generator-adaptiveme,,"['Flexible', 'Modular', 'Powerful']",Creates adaptive web apps with ease,,mobile app framework,cohere,,,,2021.0
tagbuildr,a JavaScript utility to build and manage HTML tags using constructor pattern.,https://github.com/75lb/tagbuildr,2013.0,"['Efficient', 'Versatile', 'User-Friendly']",Solves the problem of creating and managing DOM elements.,Not suitable for React users.,DOM manipulation utils,cohere,,,,
realdom,a tiny package that allows you to create DOM elements on the fly using JavaScript.,https://github.com/phillipj/realdom,2014.0,"['Tiny', 'Easy to Use', 'Lighter Weight']",Simplifies dynamic DOM creation.,Does not cover CSS utilities.,DOM manipulation utils,cohere,,,,
tsdom,a TypeScript to DOM types compiler.,https://github.com/palantir/tsdom,2016.0,"['TypeScript-Centric', 'Compatibility', 'Proven']",Allows for type-safe DOM manipulation for TypeScript users.,Limited to TypeScript environment and may be overly complex for casual users.,DOM manipulation utils,cohere,,,,
ng-html-util,a set of utilities for sanitizing and constructing HTML from trusted and untrusted sources.,https://github.com/ng-html-utils/ng-html-utils,2016.0,"['Security-Centric', 'Trusted by Many', 'Robust']",Provides a safe way to construct and sanitize HTML in a Angular environment.,Limited to Angular users and may be overly complex for casual users.,DOM manipulation utils,cohere,,,,
elementsjs,"a collection of elements inspired by the most unusual and creative websites built with HTML, CSS, and JavaScript.",http://www.elementsjs.com/,2016.0,"['Creative', 'Inspiring', 'Fun']",Provides a wide variety of creative DOM elements to choose from.,May not be suitable for professional or enterprise applications.,DOM manipulation utils,cohere,,,,
tnt-dom,a tiny but flexible DOM manipulation toolkit.,https://github.com/melonjs/tnt.js,2013.0,"['Tiny', 'Flexible', 'Supportive']","Provides a simple, lightweight solution for DOM manipulation.",May not have as many features as some more robust alternatives.,DOM manipulation utils,cohere,,,,
react-classset,a micro library for React that provides a simple way to set CSS classes on React elements.,https://github.com/joeattardi/react-classset,2016.0,"['Micro', 'React-Centric', 'Elegant']",Provides a simple way to manage classes in a React environment.,Limited to React users and may be overly simple for complex applications.,DOM manipulation utils,cohere,,,,
dom101,a collection of DOM helper functions.,https://github.com/WebReflection/dom101,2015.0,"['Helper-Centric', 'Informative', 'Educational']",Provides a variety of helpful utilities for DOM manipulation.,May be too basic for complex projects.,DOM manipulation utils,cohere,,,,
css-util,a collection of utilities to work with CSS class names.,https://github.com/joeattardi/css-util,2016.0,"['Specific', 'Efficient', 'Streamlined']",Provides a focused solution for working with CSS class names.,May not cover all aspects of CSS utilities.,DOM manipulation utils,cohere,,,,
ng-dom,AngularJS directive for DOM manipulation.,https://github.com/angular-ui/ng-dom,2014.0,"['Community-Tested', 'Angular-Centric', 'Powerful']",Provides a way to create DOM elements in an AngularJS environment.,Limited to Angular users and may be overly complex for casual users.,DOM manipulation utils,cohere,,,,
mathsass,A library for parsing and evaluating the SASS language used within stylesheets.,https://www.npmjs.com/package/mathsass,2017.0,"['Specific', 'Effective', 'Versatile']",Great for complex mathematical operations within stylesheets.,May not be the most efficient solution for other mathematical use-cases.,mathematical functions,cohere,,,,
simple-math,A small and fast library for the basic arithmetic operations.,https://www.npmjs.com/package/simple-math,2016.0,"['Easy-to-Use', 'Lightweight', 'Fast']","Ideal for simple arithmetic operations, it's not bloated and works well.",It is not suitable for complex mathematical tasks.,mathematical functions,cohere,,,,
rational-number,A library that provides arbitrary precision arithmetic.,https://www.npmjs.com/package/rational-number,2016.0,"['Precise', 'Versatile', 'Powerful']","Great for calculations that require high precision, such as financial or scientific applications.",Can be overkill for simpler arithmetic.,mathematical functions,cohere,,,,
cheerio,Simplified implementation of core jQuery designed specifically for the server.,https://www.npmjs.com/package/cheerio,2014.0,"['Versatile', 'Easy-to-Use', 'Well-Maintained']","['Widely used for server-side JavaScript applications', 'Simplifies jQuery for server-side processing', 'Small size and fast execution']","['Does not provide GUI-related functionalities', 'Limited compatibility with web browsers']",scraper,cohere,,,,
thepiratebay,A JavaScript wrapper for the PirateBay API.,https://www.npmjs.com/package/thepiratebay,2017.0,"['Specific', 'Community-Supported', 'Active']","['Provides an easy way to interact with the PirateBay API', 'Enables searching, grabbing info and downloading right from Node.js code', 'Active development and updates']","['Limited to PirateBay as a source', 'May not be suitable for general-purpose scraping needs', 'Depends on the PirateBay API availability']",scraper,cohere,,,,
github-scraper,Scrape data from GitHub user/organization profiles.,https://www.npmjs.com/package/github-scraper,2016.0,"['Specific', 'Community-Maintained', 'Active']","['Dedicated to scraping GitHub data', 'Continuously updated by contributors', 'Useful for various types of GitHub data extraction']","['Limited to GitHub as a data source', 'May not support all GitHub features or changes in API', 'Depends on GitHub API availability']",scraper,cohere,,,,
hquery.php,"A simple, flexible, and humane HTML/XML query parser.",https://github.com/n1koo/hquery-php,2015.0,"['Simple', 'Flexible', 'Humane']","['Easy to use, simplifies HTML querying', 'Flexibility for different use cases', 'Focus on humane coding practices']","['May not have as many powerful features compared to other packages', 'Based on volunteer contributions', 'Not actively maintained']",scraper,cohere,,,,
html-miner,A extraction library for HTML.,https://www.npmjs.com/package/html-miner,2016.0,"['Specific', 'Optimized', 'Well-Maintained']","['Focussed on data extraction from HTML', 'Designed for efficiency and simplicity', 'Active maintenance and updates']","['Does not handle XML or other markup languages', 'Limited to HTML extraction capabilities', 'Lack of advanced parsing options']",scraper,cohere,,,,
linkscrape,"Scrape websites without forcing a DOM, speed up development.",https://www.npmjs.com/package/linkscrape,2017.0,"['Efficient', 'Versatile', 'Simplified']","['Allows scraping websites without forcing a DOM', 'Designed for speed and efficiency of scrape', 'Able to extract data from multiple sources']","['May not work on all websites without a DOM', 'Dependent on the structure and accessibility of the website', 'Lacks advanced parsing options']",scraper,cohere,,,,
meta-scraper,Scrapes metadata from websites.,https://www.npmjs.com/package/meta-scraper,2016.0,"['Specific', 'Customizable', 'Well-Maintained']","['Focussed on scraping metadata which fits many needs', 'Provides customization for different sources', 'Active development and updates']","['Limited to metadata extraction', 'Dependent on the structure and availability of metadata', 'May require additional configuration']",scraper,cohere,,,,
htmlmetaparser,A library for extracting metadata and information from HTML.,https://www.npmjs.com/package/htmlmetaparser,2016.0,"['Specific', 'Powerful', 'Well-Maintained']","['Able to extract metadata from HTML', 'Powerful parsing options', 'Active development and updates']","['Limited to HTML metadata extraction', 'Dependent on the structure and availability of HTML metadata', 'May not handle invalid HTML effectively']",scraper,cohere,,,,
onroto-standings-scraper,A Node.js module to scrape standings from Onroto.,https://www.npmjs.com/package/onroto-standings-scraper,2018.0,"['Specific', 'Up-to-Date', 'Active']","['Dedicated to scraping Onroto standings', 'Regular updates and maintenance', 'Actively developed']","['Limited to Onroto standings', 'May not handle changes to the Onroto website effectively', 'Does not support scraping of other sports sites']",scraper,cohere,,,,
cheerio-advanced-selectors,Extends cheerio with more selector types.,https://www.npmjs.com/package/cheerio-advanced-selectors,2018.0,"['Extended', 'Powerful', 'Simplified']","['Provides more selector types for cheerio', 'Simplifies selecting complex elements', 'Well-documented']","['Adds more complexity', 'May not be compatible with all cheerio plugins', ""Dependent on cheerio's stability""]",scraper,cohere,,,,
