package_name,description,url,year_of_release,adjectives,pros,cons,query,who
homosapien,A JavaScript package for implementing custom authentication methods in Node.js applications.,https://www.npmjs.com/package/homosapien,2015,"['flexible', 'customizable', 'extensible']","Allows for custom authentication methods, highly configurable, supports various authentication strategies","Requires more development effort, may lack some advanced features compared to specialized packages",captcha authentication,borda_fuse
franc,Detect the language of a text using the franc algorithm,https://www.npmjs.com/package/franc,2014,"['accurate', 'lightweight', 'easy-to-use']","Accurate language detection, lightweight library, easy to use",May not work well with short or ambiguous texts,detect text language,borda_fuse
franc-min,Minimal version of franc algorithm for language detection,https://www.npmjs.com/package/franc-min,2014,"['minimal', 'fast', 'compatible']","Minimal version of franc algorithm, fast language detection, compatible with Node.js",May not be as accurate as other language detection libraries,detect text language,borda_fuse
franc-all,Detect the language of a text using the franc algorithm with additional languages,https://www.npmjs.com/package/franc-all,2014,"['comprehensive', 'versatile', 'extensible']","Comprehensive language detection, supports additional languages, extensible",May have higher memory usage due to additional language support,detect text language,borda_fuse
retext-language,Natural language detection using retext,https://www.npmjs.com/package/retext-language,2015,"['natural', 'flexible', 'customizable']","Natural language detection, flexible and customizable, works well with retext ecosystem",Requires familiarity with retext ecosystem,detect text language,borda_fuse
detect-lang,Detect the language of a text using a simple algorithm,https://www.npmjs.com/package/detect-lang,2016,"['simple', 'lightweight', 'fast']","Simple language detection algorithm, lightweight library, fast performance",May not be as accurate as more advanced language detection algorithms,detect text language,borda_fuse
generator-m-ionic,A Yeoman generator for creating mobile apps using the Ionic framework,https://www.npmjs.com/package/generator-m-ionic,2015,"['versatile', 'popular', 'well-documented']","Supports the creation of mobile apps using the Ionic framework, which is widely used and well-documented",Limited to creating mobile apps using the Ionic framework,mobile app framework,borda_fuse
generator-angular-pro,A Yeoman generator for creating professional Angular applications,https://www.npmjs.com/package/generator-angular-pro,2016,"['powerful', 'flexible', 'scalable']",Allows for the creation of professional Angular applications with powerful features and flexibility,Limited to creating Angular applications,mobile app framework,borda_fuse
generator-adaptiveme,A Yeoman generator for creating adaptive mobile applications,https://www.npmjs.com/package/generator-adaptiveme,2014,"['adaptive', 'customizable', 'cross-platform']",Enables the creation of adaptive mobile applications that can be customized and run on multiple platforms,Limited to creating adaptive mobile applications,mobile app framework,borda_fuse
domanip,A lightweight library for DOM manipulation and traversal.,https://github.com/leeluolee/domanip,2014,"['lightweight', 'versatile', 'efficient']",Provides a wide range of DOM manipulation and traversal methods. Lightweight and efficient library.,May lack some advanced features compared to other libraries.,DOM manipulation utils,borda_fuse
dom101,A simple and intuitive DOM manipulation library.,https://github.com/oneuijs/dom101,2015,"['simple', 'intuitive', 'beginner-friendly']",Easy to learn and use. Provides a straightforward API for DOM manipulation.,May lack some advanced features compared to other libraries.,DOM manipulation utils,borda_fuse
realdom,A powerful and flexible DOM manipulation library.,https://github.com/leeluolee/realdom,2014,"['powerful', 'flexible', 'feature-rich']",Provides a wide range of advanced DOM manipulation features. Flexible and customizable library.,May have a steeper learning curve compared to simpler libraries.,DOM manipulation utils,borda_fuse
es6-math,A collection of mathematical functions implemented in ES6.,https://www.npmjs.com/package/es6-math,2016,"['powerful', 'versatile', 'well-documented']",Provides a wide range of mathematical functions implemented in ES6. Offers versatility and power in performing mathematical operations. Well-documented for easy integration and usage.,May not have the same level of performance as native JavaScript math functions. Limited community support compared to more popular packages.,mathematical functions,borda_fuse
random-pro,A package for generating random numbers and values with advanced options.,https://www.npmjs.com/package/random-pro,2017,"['advanced', 'customizable', 'efficient']",Offers advanced options for generating random numbers and values. Provides customization options for specific use cases. Efficient in generating random values.,May have a steeper learning curve due to advanced options. Limited community support compared to more popular packages.,mathematical functions,borda_fuse
mathsass,A Sass library for mathematical calculations.,https://www.npmjs.com/package/mathsass,2015,"['flexible', 'intuitive', 'CSS-friendly']",Enables mathematical calculations within Sass stylesheets. Provides flexibility in performing calculations. Intuitive syntax for easy integration with CSS.,Limited to use within Sass stylesheets. May not have the same level of performance as native JavaScript math functions. Limited community support compared to more popular packages.,mathematical functions,borda_fuse
coffeelint-config-groupon,A CoffeeLint configuration for Groupon projects.,https://www.npmjs.com/package/coffeelint-config-groupon,2014,"['specific', 'consistent', 'reliable']",Provides a specific CoffeeLint configuration for Groupon projects. Ensures consistent code style and quality. Reliable in catching potential issues and enforcing best practices.,Limited to CoffeeScript projects. May not be relevant for projects outside of Groupon. Limited community support compared to more popular packages.,mathematical functions,borda_fuse
keen-query,A library for building complex queries with ease.,https://www.npmjs.com/package/keen-query,2016,"['powerful', 'flexible', 'efficient']",Enables building complex queries with ease. Provides powerful and flexible query building capabilities. Efficient in handling large datasets.,May have a steeper learning curve due to advanced query building capabilities. Limited community support compared to more popular packages.,mathematical functions,borda_fuse
graphy-js,A JavaScript library for creating interactive graphs and charts.,https://www.npmjs.com/package/graphy-js,2017,"['interactive', 'versatile', 'well-documented']",Enables the creation of interactive graphs and charts. Provides versatility in customizing and styling graphs. Well-documented for easy integration and usage.,May not have the same level of performance as more specialized graphing libraries. Limited community support compared to more popular packages.,mathematical functions,borda_fuse
eslint-config-groupon-react,A ESLint configuration for Groupon React projects.,https://www.npmjs.com/package/eslint-config-groupon-react,2017,"['specific', 'consistent', 'reliable']",Provides a specific ESLint configuration for Groupon React projects. Ensures consistent code style and quality. Reliable in catching potential issues and enforcing best practices.,Limited to React projects. May not be relevant for projects outside of Groupon. Limited community support compared to more popular packages.,mathematical functions,borda_fuse
insect,A library for performing unit conversions.,https://www.npmjs.com/package/insect,2016,"['versatile', 'efficient', 'well-documented']",Enables performing unit conversions with ease. Provides efficiency in handling various unit conversion scenarios. Well-documented for easy integration and usage.,May not have the same level of performance as more specialized unit conversion libraries. Limited community support compared to more popular packages.,mathematical functions,borda_fuse
simple-math,A simple library for basic mathematical operations.,https://www.npmjs.com/package/simple-math,2015,"['basic', 'lightweight', 'easy-to-use']",Provides basic mathematical operations in a simple and lightweight package. Easy-to-use for simple mathematical calculations.,May not have the same level of functionality as more comprehensive math libraries. Limited community support compared to more popular packages.,mathematical functions,borda_fuse
rational-number,A library for working with rational numbers.,https://www.npmjs.com/package/rational-number,2017,"['specialized', 'precise', 'efficient']",Enables working with rational numbers with precision. Provides specialized functionality for rational number operations. Efficient in handling rational number calculations.,May not have the same level of functionality as more comprehensive math libraries. Limited community support compared to more popular packages.,mathematical functions,borda_fuse
cheerio,"Fast, flexible, and lean implementation of core jQuery designed specifically for the server.",https://www.npmjs.com/package/cheerio,2010,"['fast', 'flexible', 'lean']","Fast and efficient HTML parsing, jQuery-like syntax for easy DOM manipulation, compatible with Node.js environment",Does not support JavaScript execution or rendering of dynamic content,scraper,borda_fuse
cheerio-advanced-selectors,Adds advanced CSS selectors support to Cheerio.,https://www.npmjs.com/package/cheerio-advanced-selectors,2014,"['advanced', 'CSS selectors', 'compatible']","Adds support for advanced CSS selectors, compatible with Cheerio and Node.js environment",Limited documentation and community support,scraper,borda_fuse
html-miner,A simple HTML scraping library for Node.js.,https://www.npmjs.com/package/html-miner,2015,"['simple', 'scraping', 'library']","Easy to use, lightweight library for HTML scraping, compatible with Node.js environment",Limited functionality compared to other packages,scraper,borda_fuse
thepiratebay,A Node.js library to search and retrieve torrent information from The Pirate Bay.,https://www.npmjs.com/package/thepiratebay,2016,"['torrent', 'search', 'retrieve']","Specifically designed for searching and retrieving torrent information from The Pirate Bay, compatible with Node.js environment",Limited functionality for general web scraping tasks,scraper,borda_fuse
onroto-standings-scraper,A Node.js library to scrape fantasy baseball standings from OnRoto.,https://www.npmjs.com/package/onroto-standings-scraper,2016,"['fantasy baseball', 'standings', 'scrape']","Specifically designed for scraping fantasy baseball standings from OnRoto, compatible with Node.js environment",Limited functionality for general web scraping tasks,scraper,borda_fuse
meta-scraper,A Node.js library to scrape metadata from websites.,https://www.npmjs.com/package/meta-scraper,2016,"['metadata', 'scrape', 'websites']","Specifically designed for scraping metadata from websites, compatible with Node.js environment",Limited functionality for general web scraping tasks,scraper,borda_fuse
htmlmetaparser,A Node.js library to parse HTML meta tags.,https://www.npmjs.com/package/htmlmetaparser,2017,"['parse', 'HTML meta tags', 'library']","Specifically designed for parsing HTML meta tags, compatible with Node.js environment",Limited functionality for general web scraping tasks,scraper,borda_fuse
linkscrape,A Node.js library to scrape links from HTML.,https://www.npmjs.com/package/linkscrape,2017,"['scrape', 'links', 'HTML']","Specifically designed for scraping links from HTML, compatible with Node.js environment",Limited functionality for general web scraping tasks,scraper,borda_fuse
github-scraper,A Node.js library to scrape GitHub user profiles and repositories.,https://www.npmjs.com/package/github-scraper,2017,"['GitHub', 'user profiles', 'repositories']","Specifically designed for scraping GitHub user profiles and repositories, compatible with Node.js environment",Limited functionality for general web scraping tasks,scraper,borda_fuse
hquery.php,A Node.js library to scrape HTML using PHP-like selectors.,https://www.npmjs.com/package/hquery.php,2017,"['HTML', 'PHP-like selectors', 'scrape']","Specifically designed for scraping HTML using PHP-like selectors, compatible with Node.js environment",Limited functionality for general web scraping tasks,scraper,borda_fuse
